{
  "bank_schema_version": "bank_decision.v1.1",
  "decision_id": "bank_20260323_003",
  "pick_id": "btts_20260323_003",
  "module_origin": "btts",
  "decision_status": "BLOCKED",
  "stake_base": 0.75,
  "stake_suggested": 0.75,
  "stake_approved": 0.0,
  "stake_pct_bankroll": 0.0,
  "bank_state_mode": "Normal",
  "portfolio_group": "optional",
  "exposure_bucket": "day_high",
  "execution_order": 99,
  "approved_odds_window": "1.70-1.90",
  "rules_triggered": [
    "BLOCK_DUPLICATE_FIXTURE"
  ],
  "block_reason_code": "BLOCK_DUPLICATE_FIXTURE",
  "block_reason_text": "Ja existe entrada aprovada para a mesma fixture. Regra de fixture unica acionada.",
  "bankroll_before": 412.5,
  "daily_exposure_before": 3.5,
  "daily_exposure_after_if_accepted": 3.5,
  "decision_timestamp": "2026-03-23T10:17:00Z",
  "bankroll_note": "Bloqueio estrutural para evitar duplicacao do jogo."
}