{
  "bank_schema_version": "bank_decision.v1.1",
  "decision_id": "bank_20260323_204",
  "pick_id": "corners_20260323_106",
  "module_origin": "corners",
  "decision_status": "RESERVE",
  "stake_base": 0.50,
  "stake_suggested": 0.50,
  "stake_approved": 0.00,
  "stake_pct_bankroll": null,
  "bank_state_mode": "Defesa",
  "portfolio_group": "optional",
  "exposure_bucket": "day_high",
  "execution_order": null,
  "approved_odds_window": null,
  "rules_triggered": ["REDUCE_DAY_EXPOSURE"],
  "block_reason_code": null,
  "block_reason_text": null,
  "bankroll_before": 500.0,
  "daily_exposure_before": 3.9,
  "daily_exposure_after_if_accepted": 3.9,
  "decision_timestamp": "2026-03-23T12:03:00Z",
  "bankroll_note": "Mantida em reserva por contexto prudencial e baixa prioridade relativa."
}
