{
  "bank_schema_version": "bank_decision.v1.1",
  "decision_id": "bank_20260323_203",
  "pick_id": "btts_20260323_103",
  "module_origin": "btts",
  "decision_status": "BLOCKED",
  "stake_base": 0.75,
  "stake_suggested": 0.75,
  "stake_approved": 0.00,
  "stake_pct_bankroll": null,
  "bank_state_mode": "Normal",
  "portfolio_group": "optional",
  "exposure_bucket": "day_medium",
  "execution_order": null,
  "approved_odds_window": null,
  "rules_triggered": ["BLOCK_DUPLICATE_FIXTURE"],
  "block_reason_code": "BLOCK_DUPLICATE_FIXTURE",
  "block_reason_text": "event_id já bloqueado por decisão aprovada anterior.",
  "bankroll_before": 500.0,
  "daily_exposure_before": 2.5,
  "daily_exposure_after_if_accepted": 2.5,
  "decision_timestamp": "2026-03-23T12:02:00Z",
  "bankroll_note": "Bloqueio por fixture lock."
}
