{
  "bank_schema_version": "bank_decision.v1.1",
  "decision_id": "bank_20260323_201",
  "pick_id": "v12_20260323_101",
  "module_origin": "v12",
  "decision_status": "APPROVED",
  "stake_base": 1.25,
  "stake_suggested": 1.50,
  "stake_approved": 1.50,
  "stake_pct_bankroll": 2.1,
  "bank_state_mode": "Normal",
  "portfolio_group": "core",
  "exposure_bucket": "day_low",
  "execution_order": 1,
  "approved_odds_window": "1.40-1.48",
  "rules_triggered": [],
  "block_reason_code": null,
  "block_reason_text": null,
  "bankroll_before": 500.0,
  "daily_exposure_before": 1.0,
  "daily_exposure_after_if_accepted": 2.5,
  "decision_timestamp": "2026-03-23T12:00:00Z",
  "bankroll_note": "Entrada plena por prioridade Best e risco muito controlado."
}
