{
  "bank_schema_version": "bank_decision.v1.1",
  "decision_id": "bank_20260323_202",
  "pick_id": "corners_20260323_102",
  "module_origin": "corners",
  "decision_status": "APPROVED_REDUCED",
  "stake_base": 1.00,
  "stake_suggested": 1.00,
  "stake_approved": 0.75,
  "stake_pct_bankroll": 1.4,
  "bank_state_mode": "Alerta",
  "portfolio_group": "satellite",
  "exposure_bucket": "day_medium",
  "execution_order": 3,
  "approved_odds_window": "1.83-1.91",
  "rules_triggered": ["REDUCE_PARTIAL_CORRELATION", "REDUCE_BANK_ALERT"],
  "block_reason_code": null,
  "block_reason_text": null,
  "bankroll_before": 500.0,
  "daily_exposure_before": 2.0,
  "daily_exposure_after_if_accepted": 2.75,
  "decision_timestamp": "2026-03-23T12:01:00Z",
  "bankroll_note": "Corte por correlação parcial e modo Alerta."
}
